,nama,harga,deskripsi,detail,link gambar,link
346,HAFALAN MUDAH DOA SEHARI HARI  BACAAN SHALAT  DAN SURAH SURAH PENDEK,"Rp.24,000 ","
          Buku ini mengandung bacaan yang mesti dihafal ketika beribadah maupun aktivitas sehari-hari. Melalui penyusunan yang mudah dipahami oleh semua umur, buku ini berisikan materi berikut:


1. Kumpulan Doa Sehari-hari;
2. Lafal Azan dan Iqamah beserta Doanya;
3. Tata Cara Wudhu dan Tayamum;
4. Bacaan Shalat Subuh, Zuhur, Ashar, Maghrib, dan Isya;
5. Bacaan Zikir dan Doa Sesudah Shalat;

Hafalan Surah-surah Pendek.        ","{'Kategori': 'Agama', 'Ketebalan': '168 Halaman', 'Dimensi': '13 x 19 cm', 'Bahasa': 'Indonesia', 'Stock': 'Tersedia', 'Penerbit': 'Anak Hebat Indonesia', 'Penulis': 'Ust. Arifin Idham', 'Berat': '300 gram', 'Product Tags': ' \nanak hebat indonesia\n\n'}",https://www.solusibuku.com/image/c/data/produk/2020/eksternal/anakhebat/Slide415-cr-500x500.JPG,https://www.solusibuku.com/agama/hafalan-mudah-doa-seharihari-bacaan-shalat-dan-surahsurah-pendek.html
347,LET’S CHANGE YOUR BAD HABITS,"Rp.45,200 ","
          Buku ini akan mengubah cara berpikir kita agar menjadi pribadi yang lebih baik, lebih berani bermimpi dan berani mewujudkan, optimis dalam menghadapi tantangan. Selain itu, dijelaskan pula bagaimana pengaruh lingkungan terhadap pembentukan kepribadian kita, peran orang lain, dan bagaimana menghadapi orang lain. Beberapa pembahasan lain yang ada dalam buku ini yaitu:

Bagaimana menjadi pribadi yang berkarakter kuat?
Bagaimana menjadi high quality person?
Bagaimana mendesain peta kehidupan kita?
Bagaimana menemukan passion kita?
Bagaimana cara mengubah kebiasaan buruk kita?
Bagaimana cara mendisiplinkan diri?
Bagaimana cara belajar dari orang-orang sukses?
Bagaimana menjadi seorang trendsetter?        ","{'Kategori': 'Agama', 'Ketebalan': '312 Halaman', 'Dimensi': '14 x20 cm', 'Bahasa': 'Indonesia', 'Stock': 'Tersedia', 'Penerbit': 'Anak Hebat Indonesia', 'Penulis': 'Badrul Munier Buchori', 'Berat': '300 gram', 'Product Tags': ' \nanak hebat indonesia\n\n'}",https://www.solusibuku.com/image/c/data/produk/2020/eksternal/anakhebat/Slide416-cr-500x500.JPG,https://www.solusibuku.com/agama/let-s-change-your-bad-habits.html
348,101 CARA MENJADI MUSLIM PRODUKTIF DAN JUARA,"Rp.38,000 ","
          “Sebaik-baik manusia adalah yang paling bermanfaat bagi manusia.”

Bisa kita ambil poin bahwa Islam mendorong umatnya untuk senantiasa produktif, sebab produktif adalah tentang bermanfaat bagi diri sendiri dan sesama manusia. Namun, adakalanya kita menjumpai fase di mana hidup kita kurang produktif. Atau bahkan saat ini kita berada pada fase tersebut.

Menjadi produktif sendiri tidak dapat dibentuk dalam satu malam seperti kisah Roro Jonggrang. Melainkan melalui proses yang panjang dan berkelanjutan. Menjadi produktif adalah tentang membangun kebiasaan positif yang berkesinambungan, hingga tak ada lagi celah untuk mengisinya dengan kegiatan-kegiatan negatif.

Buku ini berisi 101 tips yang bisa kawan-kawan praktikkan untuk menjadi pribadi yang produktif dan bermanfaat. Dibahas dalam bentuk poin-poin yang ringan, setiap tips dalam buku ini sangat cocok dipraktikkan dalam keseharian.

        ","{'Kategori': 'Agama', 'Ketebalan': '240 Halaman', 'Dimensi': '14 x20 cm', 'Bahasa': 'Indonesia', 'Stock': 'Tersedia', 'Penerbit': 'Anak Hebat Indonesia', 'Penulis': 'Anny Safitri', 'Berat': '300 gram', 'Product Tags': ' \nanak hebat indonesia\n\n'}",https://www.solusibuku.com/image/c/data/produk/2020/eksternal/anakhebat/Slide417-cr-500x500.JPG,https://www.solusibuku.com/agama/101-cara-menjadi-muslim-produktif-dan-juara.html
349,99 PRINSIP BISNIS SUKSES ALA RASULULLAH,"Rp.63,600 ","
          Melalui buku ini, Selain bisa menerapkan aturan-aturan dalam berbisnis dengan untung melimpah sekaligus berkah, Anda juga akan mendapatkan pembelajaran dari setiap praktik bisnis yang dilakukan oleh Rasulullah ﷺ pada masanya. Sebab sebagai seorang rasul, beliau ﷺ telah menanamkan prinsip yang kuat bahwa hari ini haruslah lebih baik dari kemarin, dan esok harus lebih baik dari hari ini. Prinsip inilah yang membuat kariernya berkembang begitu pesat. Maka, bila bisnis Anda ingin sukses dan berkah dunia dan akhirat, buku ini pantas menjadi teman istimewa yang selalu menemani dan memandu Anda dalam meraih kesuksesan bisnis. Sebab, melalui bahasa yang enak dibaca, dan mudah dipahami, buku ini menyajikan 99 prinsip berbisnis sukses dan penuh berkah secara mendetail dan bisa langsung Anda praktikkan. Jika Anda ingin mewujudkan impian  menjadi seorang pebisnis yang sukses dan penuh berkah, bacalah buku ini sampai tuntas.        ","{'Kategori': 'Agama', 'Ketebalan': '480 Halaman', 'Dimensi': '14 x20 cm', 'Bahasa': 'Indonesia', 'Stock': 'Tersedia', 'Penerbit': 'Anak Hebat Indonesia', 'Penulis': 'A.R. Shohibul Ulum', 'Berat': '300 gram', 'Product Tags': ' \nanak hebat indonesia\n\n'}",https://www.solusibuku.com/image/c/data/produk/2020/eksternal/anakhebat/Slide418-cr-500x500.JPG,https://www.solusibuku.com/agama/99-prinsip-bisnis-sukses-ala-rasulullah.html
350,KUMPULAN DOA KHUSUS UNTUK MUSLIMAH,"Rp.43,600 ","
          Buku Kumpulan Doa Khusus untuk Muslimah ini dapat menjadi teman sehari-hari, muhasabah harian, taman zikir, kawan kontemplasi bahkan penghilang stres.

Dengan buku ini, kita lebih mengenal lagi bagaimana doa itu bersistem sampai kemudian di–ijabah oleh Allah SWT. Buku ini pastinya juga akan berisi banyak doa-doa yang lazimnya diperuntukkan bagi para muslimah.

 

Doa Kebaikan Dunia dan Akhirat
Doa Memohon Ampunan dan Kasih Sayang Allah
Doa Meminta Rezeki yang Baik
Doa Meminta Rezeki yang Berkah
Doa Dijauhkan dari Rezeki Haram
Doa Agar Diberi Ketetapan Iman dan Islam
Doa Memohon Petunjuk Allah Subhanahu wa Ta’ala
Doa Agar Dimasukkan ke dalam Golongan yang Baik
Doa Memohon Perlindungan dari Ganguan Jin dan Setan
Doa Memohon Perlindungna dari Kesesatan
Doa Agar Memiliki Rasa Takut kepada Allah Subhanau wa Ta’ala
Doa Memohon Ampunan dan Rahmat Allah Subhanahu wa Ta’ala        ","{'Kategori': 'Agama', 'Ketebalan': '320 Halaman', 'Dimensi': '14 x20 cm', 'Bahasa': 'Indonesia', 'Stock': 'Tersedia', 'Penerbit': 'Anak Hebat Indonesia', 'Penulis': 'A. Septiyani', 'Berat': '300 gram', 'Product Tags': ' \nanak hebat indonesia\n\n'}",https://www.solusibuku.com/image/c/data/produk/2020/eksternal/anakhebat/Slide419-cr-500x500.JPG,https://www.solusibuku.com/agama/kumpulan-doa-khusus-untuk-muslimah.html
351,FIHI MA FIHI  MENGUNGKAP MISTERI CINTA & KEBIJAKSANAAN ALA RUMI,"Rp.68,400 ","
          “Siang dan malam di dunia ini engkau mencari ketenteraman dan kedamaian, walaupun sesungguhnya tidak mungkin engkau mencapai mereka di dunia. Namun demikian, pencarianmu tentu tidak sia-sia. Ketenteraman dan kedamaian tentu bisa hadir, meski hanya sekejap. Kedamaian apa pun yang engkau temukan di dunia ini tidaklah abadi. Kehadirannya bagai kilat yang menyambar. Ia hadir disertai situasi penuh Guntur, hujan, salju, dan godaan.”

Begitulah penggalan bait Rumi dalam kitab yang menjadi rujukan wajib pengembara jalan dan laku spiritual. Dalam perjalanan pencarian hakikat diri ini, buku ini dipandang sebagai buku pembuka yang menjembatani antara dunia fisik jasmani dan apa-apa yang dilakukan dengannya menuju ke dunia tak kasatmata yang disebut dengan batin. Dengan kata lain, kita bergerak masuk ke dalam batin yang mahaluas yang akan memberi kita pengalaman-pengalaman spiritual lain yang penuh sensasi. Ranah hakikat itulah ranah batin. Bisa juga disebut dengan perjalanan esoteric karena bergerak menuju inti misteri Ilahi dan alam semesta ini        ","{'Kategori': 'Agama', 'Ketebalan': '442 Halaman', 'Dimensi': '14 x20 cm', 'Bahasa': 'Indonesia', 'Stock': 'Tersedia', 'Penerbit': 'Anak Hebat Indonesia', 'Penulis': 'Jalaludin Rumi', 'Berat': '300 gram', 'Product Tags': ' \nanak hebat indonesia\n\n'}",https://www.solusibuku.com/image/c/data/produk/2020/eksternal/anakhebat/Slide420-cr-500x500.JPG,https://www.solusibuku.com/agama/fihi-ma-fihi-mengungkap-misteri-cinta-dan-kebijaksanaan-ala-rumi.html
352,ISTRI PERINDU SURGA  IKHTIAR MUDAH DAN PRAKTIS BAGI ISTRI UNTUK MENGGAPAI SURGA ALLAH,"Rp.30,000 ","
          Sebagai seorang Muslimah, sudah sepantasnya kita mewujudkan kehidupan rumah tangga yang diridhai oleh Allah. Surga sebagai imbalan nyata bagi wanita salihah pantas kita perjuangkan. Tapi terkadang, rasa syukur kita atas segala nikmat dari Allah kian memudar. Namun, kita senantiasa merindukan surga-Nya. Lantas, apakah kita masih pantas merindukan surga dengan amal perbuatan kita saat ini? Melalui buku ini, penulis mengajak kita semua, khususnya para Muslimah untuk selalu berikhtiar melaksanakan amalan agar rasa rindu kita akan surga-Nya semakin menguatkan iman kita. Teruslah istiqamah menapaki jalan Allah yang lurus, sehingga kita bisa menggapai surga-Nya. Sebab, Allah telah membentangkan peluang bagi kita dalam memperoleh pahala untuk kebahagiaan abadi di surga nanti. Semoga buku ini setidaknya bisa memandu wahai Muslimah sekalian dalam ikhtiar menggapai surga yang siang malam selalu kita rindukan.        ","{'Kategori': 'Agama', 'Ketebalan': '208 Halaman', 'Dimensi': '14 x20 cm', 'Bahasa': 'Indonesia', 'Stock': 'Tersedia', 'Penerbit': 'Anak Hebat Indonesia', 'Penulis': 'Lestari Ummu Al Fatih', 'Berat': '300 gram', 'Product Tags': ' \nanak hebat indonesia\n\n'}",https://www.solusibuku.com/image/c/data/produk/2020/eksternal/anakhebat/Slide421-cr-500x500.JPG,https://www.solusibuku.com/agama/istri-perindu-surga-ikhtiar-mudah-dan-praktis-bagi-istri-untuk-menggapai-surga-allah.html
353,AL HIKAM  SEBUAH KITAB TENTANG KEBIJAKSANAAN,"Rp.104,000","
          Bebaskanlah dirimu dari mengurusi urusan dunia. Sesuatu yang telah Allah atur untukmu, tak perlu lagi kau urusi sendiri. –Hikmah ke-4.

 

Dalam rangka untuk menambah buku –buku bacaan yang bernapaskan tasawuf di kalangan masyarakat masa kini yang serba ingin segala hal yang instan dan cepat, Al Hikam, karya terbaik dari Syekh besar Ibn’ Athaillah ini dapat dijadikan patokan atu landasan dasar dalam bertasawuf. Tentu saja, dunia tasawuf tidak akan lengkap tanpa keharidan buku babon ini. Setidaknya, buku ini dapat dijadikan pondasi awal dalam mengarungi samudra indahnya dunia tasawuf.

Dunia tasawuf adalah perjalanan berat yang pasti memerlukan bimbingan. Bimbingan terbaik did jalan tasawuf adalah memiliki musryid yang baik. Dan untuk melengkapi hal itulah buku ini sampai kepada Anda. Semoga segala isi yang ada di dalam buku ini mengandung himah yang dapat dipetik oleh semua pembaca, Anda sekalian        ","{'Kategori': 'Agama', 'Ketebalan': '624 Halaman', 'Dimensi': '14 x20 cm', 'Bahasa': 'Indonesia', 'Stock': 'Tersedia', 'Penerbit': 'Anak Hebat Indonesia', 'Penulis': 'Ibn ‘Athaillah As-sakandary', 'Berat': '300 gram', 'Product Tags': ' \nanak hebat indonesia\n\n'}",https://www.solusibuku.com/image/c/data/produk/2020/eksternal/anakhebat/Slide422-cr-500x500.JPG,https://www.solusibuku.com/agama/al-hikam-sebuah-kitab-tentang-kebijaksanaan.html
354,SYUKUR DAN BAHAGIA TANPA TEPI  KIAT MENUMBUHKAN RASA SYUKUR AGAR HIDUP LEBIH BAHAGIA,"Rp.36,400 ","
          Bagi seorang mukmin, kebahagiaannya pasti akan selalu tampak di wajahnya, tetapi kesedihannya akan selalu tersimpan di dalam hatinya, agar imannya selalu terjaga. Namun, hidup ini terkadang tidak berjalan sesuai harapan kita.

Cobaan hidup yang berat dan menyakitkan senantiasa membebani pundak kita. Akan tetapi, apakah kita akan selalu bahagia, walaupun mendapat luka? Di sisi lain, berbagai berkah kehidupan nan berlimpah terkadang menjadikan kita lupa akan nikmat-Nya.  

Maka, buku sederhana ini akan memperlihatkan kiat menumbuhkan serta menyuburkan rasa syukur di dalam hati, ucapan, dan tindakan kita sehari-hari. Sehingga, hidup kita akan semakin tenteram dan bahagia. Sebab, sesungguhnya kebahagiaan hidup akan semakin nyata dirasakan seiring ungkapan syukur kita kepada-Nya.

Seraplah intisari buku ini. Sehingga, kita akan selalu bersyukur untuk memilih bahagia, agar setiap kesedihan binasa. Dengan terus bersyukur, kebahagiaan akan datang lebih besar lagi.        ","{'Kategori': 'Agama', 'Ketebalan': '256 Halaman', 'Dimensi': '14 x20 cm', 'Bahasa': 'Indonesia', 'Stock': 'Tersedia', 'Penerbit': 'Anak Hebat Indonesia', 'Penulis': 'Amirah Hanif', 'Berat': '300 gram', 'Product Tags': ' \nanak hebat indonesia\n\n'}",https://www.solusibuku.com/image/c/data/produk/2020/eksternal/anakhebat/Slide423-cr-500x500.JPG,https://www.solusibuku.com/agama/syukur-dan-bahagia-tanpa-tepi-kiat-menumbuhkan-rasa-syukur-agar-hidup-lebih-bahagia.html
355,KUMPULAN KULTUM TERLENGKAP DAN TERBAIK SEPANJANG TAHUN,"Rp.58,800 ","
          Menyampaikan dakwah merupakan perbuatan mulia bagi setiap Muslim, sebagaimana  hadis menjelaskan bahwa sampaikanlah ilmu, walaupun hanya satu ayat. Maka dari itu, dakwah menjadi tanggung jawab kita semua sebagai umat Islam.

Namun, mengajak orang lain untuk meyakini serta mengamalkan akidah dan syariah Islam tidaklah mudah. Terkadang mereka gampang jenuh dan bosan, karena materi ceramah yang disampaikan kurang menarik. Bahkan, tema kultum yang itu-itu saja serta materi ceramah yang kadang-kadang sama (telah disampaikan oleh penceramah lain) menjadi kendala bagi para penceramah, khususnya pada bulan Ramadhan.

Maka, buku ini hadir untuk mengatasi permasalahan itu. Sebab, buku Kumpulan Kultum Terlengkap dan Terbaik Sepanjang Tahun ini disusun secara detail, persuasif, serta berdasarkan dalil al-Quran dan as-Sunnah.  Dengan bahasa yang lugas, santun, dan mudah dipahami, buku ini berisikan materi-materi ceramah yang membahas tentang masalah; akidah, ibadah, akhlak, muamalah, serta takziyah. Selain itu, Anda juga akan menemukan ragam doa pembuka kultum beserta transliterasinya serta 30 materi kultum Ramadhan yang menarik sekaligus sarat hikmah.

Jadikanlah setiap ceramah Anda semakin menarik dan jamaah yang datang semakin antusias mendengarkannya, apalagi langsung mengamalkannya. Akhir kata, semoga buku ini dapat memberikan ilmu dan manfaat bagi kita semua.  Aamiin.        ","{'Kategori': 'Agama', 'Ketebalan': '480 Halaman', 'Dimensi': '14 x20 cm', 'Bahasa': 'Indonesia', 'Stock': 'Tersedia', 'Penerbit': 'Anak Hebat Indonesia', 'Penulis': 'A.R. Shohibul Ulum', 'Berat': '300 gram', 'Product Tags': ' \nanak hebat indonesia\n\n'}",https://www.solusibuku.com/image/c/data/produk/2020/eksternal/anakhebat/Slide424-cr-500x500.JPG,https://www.solusibuku.com/agama/kumpulan-kultum-terlengkap-dan-terbaik-sepanjang-tahun.html
356,MILLENNIAL MOSLEMS  KUPAS TUNTAS PERMASALAHAN GENERASI ISLAM ZAMAN NOW,"Rp.46,000 ","
          Perkembangan zaman telah membawa banyak perubahan, khususnya bagi generasi Muslim milenial. Mereka yang lahir pada awal 1980-an sampai akhir 2000-an merupakan kelompok yang paling mendominasi masyarakat saat ini, dibanding generasi sebelumnya. Mengingat, mereka lahir berbarengan dengan munculnya teknologi seperti telepon seluler dan internet, mereka pun mahir dan familier dengan benda-benda canggih tersebut. Namun, pesatnya perkembangan teknologi membuat para Muslim milenial sibuk menghabiskan waktu mereka dengan gawainya masing-masing. Akibatnya, saf-saf shalat di masjid-masjid pun sepi, kecuali oleh kaum tua. Lantas, beginikah generasi Islam bermuara?

Percayalah, generasi Muslim milenial pasti akan bangkit dan membawa perubahan yang positif di kehidupan masyarakat. Melalui buku ini, Anda akan disajikan dengan berbagai permasalahan generasi milenial beserta solusinya. Buku yang inspiratif ini ditulis berdasarkan dalil al-Quran dan Hadis. Selain itu, penulis juga mengajak para generasi milenial untuk lebih sadar dan mawas diri terhadap perkembangan zaman yang semakin pesat. Akhir kata, buku ini akan menemani Anda—para Muslim milenial—ke masa depan cerah. Selamat belajar!        ","{'Kategori': 'Agama', 'Ketebalan': '336 Halaman', 'Dimensi': '14 x20 cm', 'Bahasa': 'Indonesia', 'Stock': 'Tersedia', 'Penerbit': 'Anak Hebat Indonesia', 'Penulis': 'Ipnu Rinto Nugroho', 'Berat': '300 gram', 'Product Tags': ' \nanak hebat indonesia\n\n'}",https://www.solusibuku.com/image/c/data/produk/2020/eksternal/anakhebat/Slide425-cr-500x500.JPG,https://www.solusibuku.com/agama/millennial-moslems-kupas-tuntas-permasalahan-generasi-islam-zaman-now.html
357,FADHILAH ‘AMAL   KEUTAMAAN SHALAT  PUASA RAMADHAN  DAN AL QURAN,"Rp.79,600 ","
          Buku karya Maulana Muhammad Zakariya al-Kandahlawi rahmatullah ini merupakan kumpulan tiga kitab yang mengupas seputar keutamaan shalat, puasa Ramadhan, serta al-Quran. Pada kesempatan ini, buku ini hanya menjelaskan tiga keutamaan ibadah tersebut, yaitu mengulas tentang keutamaan shalat, keutamaan puasa Ramadhan, dan keutamaan al-Quran.

Pada pembahasan fadhilah pertama, buku ini mengulas tentang keuntungan-keuntungan mengerjakan shalat, beserta dalil-dalil al-Quran dan as-Sunnah tentang keutamaan ibadah wajib tersebut. Selain itu, buku ini juga menjelaskan ancaman-ancaman Allah bagi orang yang meninggalkan shalat. Kemudian, fadhilah kedua menjabarkan tentang keutamaan Ramadhan berdasarkan pada al-Quran dan as-Sunnah. Selanjutnya, bagian terakhir membahas tentang keutamaan al-Quran, dan berisi dalil-dalil al-Quran dan Hadis tentang keuntungan-keuntungan membaca al-Quran dan adab-adab membacanya.

Buku Fadhilah ‘Amal ini telah dialihbahasakan menjadi lebih mudah dipahami. Lantas, materi buku ini senantiasa memenuhi asupan gizi akal Anda, serta menambah pengetahuan Anda dalam menjalankan setiap amalan sesuai al-Quran dan as-Sunnah. Maka, amalkanlah kandungan dalam buku ini, sehingga Anda dapat memanen pahala yang berlipat-lipat untuk bekal dunia dan akhirat.        ","{'Kategori': 'Agama', 'Ketebalan': '472 Halaman', 'Dimensi': '14 x20 cm', 'Bahasa': 'Indonesia', 'Stock': 'Tersedia', 'Penerbit': 'Anak Hebat Indonesia', 'Penulis': 'Maulana Muhammad Zakariya al-Kandahlawi', 'Berat': '300 gram', 'Product Tags': ' \nanak hebat indonesia\n\n'}",https://www.solusibuku.com/image/c/data/produk/2020/eksternal/anakhebat/Slide426-cr-500x500.JPG,https://www.solusibuku.com/agama/fadhilah-‘amal-keutamaan-shalat-puasa-ramadhan-dan-alquran.html
358,TERJEMAH JUZ AMMA  AL MA’TSURAT  DAN PANDUAN SALAT LENGKAP,"Rp.29,200 ","
          Sebagai rukun islam yang ke-2, salat tentunya menjadi salah satu ibadah yang tidak bisa dilepaskan dari kehidupan setiap umat muslim. Selain itu, beberapa dalil juga menunjukkan kedudukan dan kemuliaan ibadah salat, di antaranya merupakan amalan yang pertama kali dihisab, serta kualitas salat seorang muslim juga menunjukkan kualitas amalan lain secara keseluruhan. Sedangkan juz amma merupakan kumpulan surat-surat pendek dalam Alquran juz ke 30 dan sering kali digunakan sebagai bacaan salat.

Untuk itu, penulis merasa perlu menyusun buku ini guna mempermudah kaum muslimin menyempurnakan ibadah salatnya sekaligus menghafal dan mempelajari surat-surat pendek dalam juz 30. Buku ini sengaja disusun dengan praktis, sistematis, dan disertai dengan terjemahan dan transliterasi agar mudah dipahami oleh pembaca sekalian. Selain itu, buku ini juga dilengkapi dengan Al-Ma’tsurat yang bisa diamalkan oleh setiap muslimin pada waktu pagi dan petang.        ","{'Kategori': 'Agama', 'Ketebalan': '228 Halaman', 'Dimensi': '14 x20 cm', 'Bahasa': 'Indonesia', 'Stock': 'Tersedia', 'Penerbit': 'Anak Hebat Indonesia', 'Penulis': 'Hanif Nur Ramdan', 'Berat': '300 gram', 'Product Tags': ' \nanak hebat indonesia\n\n'}",https://www.solusibuku.com/image/c/data/produk/2020/eksternal/anakhebat/Slide427-cr-500x500.JPG,https://www.solusibuku.com/agama/terjemah-juz-amma-alma-tsurat-dan-panduan-salat-lengkap.html
359,JUZ 'AMMA  AL MA'TSURAT  DAN TUNTUNAN SHALAT,"Rp.39,600 ","
          Buku Juz ‘Amma, al-Ma’tsurat, dan Tuntunan Shalat ini menyajikan bacaan juz 30 al-Quran beserta transliterasi, hukum bacaan, dan terjemahannya; kumpulan doa pagi dan petang sesuai sunnah Rasul; serta tuntunan shalat beserta tata cara wudhu dan tayamum. Semuanya dikemas secara mendetail, sehingga mudah dipahami oleh semua usia dan kalangan.

Lantas, buku ini tidak hanya dapat membantu Anda menghafalkan dan mempelajari surah-surah pendek (juz 30) dalam al-Quran. Akan tetapi, Anda juga bisa mengamalkan setiap bacaan doa al-Ma’tsurat agar senantiasa mendapatkan keberkahan dalam hidup. Selain itu, buku ini juga menjelaskan tentang tuntunan shalat beserta tata cara wudhu dan tayamum. Sehingga, buku ini sangat sesuai sebagai buku penunjang bagi peserta didik agama Islam, khususnya anak-anak. Semoga bermanfaat        ","{'Kategori': 'Agama', 'Ketebalan': '192 Halaman', 'Dimensi': '14 x20 cm', 'Bahasa': 'Indonesia', 'Stock': 'Tersedia', 'Penerbit': 'Anak Hebat Indonesia', 'Penulis': 'Muhammad Fakhri ', 'Berat': '300 gram', 'Product Tags': ' \nanak hebat indonesia\n\n'}",https://www.solusibuku.com/image/c/data/produk/2020/eksternal/anakhebat/Slide428-cr-500x500.JPG,https://www.solusibuku.com/agama/juz-amma-almatsurat-dan-tuntunan-shalat.html
360,66 HADIS PILIHAN PENGGUGAH JIWA MENJADI MUSLIM UNGGUL DAN PRODUKTIF,"Rp.60,400 ","
          Apakah Anda tidak malu, apabiala usia semakin bertambah, tetapi amal kalian tidak ikut bertambah? Apalagi, Anda seringkali dirundung rasa malas dalam menjalani aktivitas sehari-hari. Paling parahnya lagi, saat pekerjaan sedang menumpuk, tiba-tiba rasa malas menjangkiti Anda. Lantas, setelah mendekati waktu tenggat, Anda pun baru sadar tugas semakin menumpuk, sedangkan waktu semakin sempit. Anda pasti kerap luba bahwa saat sehat, Anda malas bersyukur; saat memiliki waktu luang, Anda pun malas memanfaatkannya.

Apabila Anda seringkali lalai dalam memanfaatkan sehat dan waktu-terutama dalam ibadah-Anda di dunia ini, lantas bekal apa yang akan kau bawa ke akhirat nanti? Maka dari itu, renungkanlah sebentar apa yang telah Anda perbuat sampai detik ini dengan membaca buku ini, apakah Anda untung atau malah merugi?

Sebab, buku ini menyajikan perengungan bagi pembaca sekalian dalam menjalani hidup. Buku ini menjabarkan 66 hadis pilihan sebagai nasihat, peringatan, serta tuntunan dari Nabi Muhammad SAW agar Anda senantiasa menjadi Muslim unggul serta memanfaatkan hidup ini untuk bermanfaat dan produktif bagi kehidupan di dunia. Sehingga, Anda memiliki bekal untuk alam akhirat kelak. Aamiin.

Selamat membaca!

Kun Kariman!        ","{'Kategori': 'Agama', 'Ketebalan': '360 Halaman', 'Dimensi': '14 x20 cm', 'Bahasa': 'Indonesia', 'Stock': 'Tersedia', 'Penerbit': 'Anak Hebat Indonesia', 'Penulis': 'A.R. Shohibul Ulum', 'Berat': '300 gram', 'Product Tags': ' \nanak hebat indonesia\n\n'}",https://www.solusibuku.com/image/c/data/produk/2020/eksternal/anakhebat/Slide429-cr-500x500.JPG,https://www.solusibuku.com/agama/66-hadis-pilihan-penggugah-jiwa-menjadi-muslim-unggul-dan-produktif.html
361,ZIKIR SUBUH  MAGRIB  DAN SETELAH SALAT 5 WAKTU  BERDASARKAN AL QURAN & SUNAH YANG SAHIH,"Rp.22,000 ","
          Secara sederhana, zikir berarti mengingat Allah, untuk itu kita diperintahkan agar senantiasa berzikir kepada Allah. Sebab hanya dengan mengingat-Nya lah, maka hati akan merasa damai, tenang, dan bahagia sebab diri ini sadar memiliki sandaran hidup. Dan sandaran hidup kita adalah Allah semata.

 

Sebagaimana Allah berfirman:

(Yaitu) orang-orang yang beriman dan hati mereka manjadi tenteram dengan mengingat Allah. Ingatlah, Hanya dengan mengingati Allah-lah hati menjadi tenteram. (Ar-Ra’d [13]: 28).

 

Demikianlah buku ini hadir untuk memaparkan tentang zikir, keutamaan, bacaan zikir pagi-petang dan sesudah salat fardu, hingga adab-adab dalam berzikir. Tidak ketingalan pula ajakan kepada kita untuk selalu bertaqarrub kepada Allah, semakin mendekat kepada-Nya, semakin cinta kepada-Nya, dan hingga akhirnya kita merenggut manisnya cinta bersama-Nya. Dengan apa? tentunya dengan zikir kepada-Nya

        ","{'Kategori': 'Agama', 'Ketebalan': '124 Halaman', 'Dimensi': '11 x 18 cm', 'Bahasa': 'Indonesia', 'Stock': 'Tersedia', 'Penerbit': 'Anak Hebat Indonesia', 'Penulis': 'Thoriq Aziz', 'Berat': '300 gram', 'Product Tags': ' \nanak hebat indonesia\n\n'}",https://www.solusibuku.com/image/c/data/produk/2020/eksternal/anakhebat/Slide430-cr-500x500.JPG,https://www.solusibuku.com/agama/zikir-subuh-magrib-dan-setelah-salat-5-waktu-berdasarkan-alquran-dan-sunah-yang-sahih.html
362,LET’S HIJRAH AND THEN SALIHAH  KARENA HIJRAH BUKAN SEKADAR TREN BERHIJAB MEWAH,"Rp.54,800 ","
          Sebagai seorang wanita, apakah Anda mengetahui kapan hidayah Allah akan datang menghampiri Anda? Cobalah sejenak berhenti, menghela napas, dan kemudian berpikir, “Apakah selama ini diri Anda telah cukup bermanfaat bagi orang lain dan lingkungan sekitar?”

Pada saat Anda masih menyibukkan diri; meniti karier, menyelesaikan pendidikan master, mendidik anak dan melayani suami (bagi yang sudah berkeluarga), atau merintis usaha sendiri, terkadang Anda sering lupa untuk introspeksi diri, bahkan lupa akan Sang Pencipta, Allah Swt. Sehingga, tanpa Anda sadari, kehidupan Anda acap kali terlunta-lunta.

Karenanya, melalui buku mungil nan sederhana ini, penulis mengajak Anda—wahai para wanita tangguh di mana pun berada—untuk senantiasa menambah ilmu, belajar meningkatkan kualitas diri sebagai seorang wanita salihah yang insya Allah selalu diridhai oleh Allah, konsisten menabung amalan baik, berbakti kepada orangtua dan keluarga, serta berguna bagi sesama.        ","{'Kategori': 'Agama', 'Ketebalan': '320 Halaman', 'Dimensi': '14 x20 cm', 'Bahasa': 'Indonesia', 'Stock': 'Tersedia', 'Penerbit': 'Anak Hebat Indonesia', 'Penulis': 'Desyana Rostika P', 'Berat': '300 gram', 'Product Tags': ' \nanak hebat indonesia\n\n'}",https://www.solusibuku.com/image/c/data/produk/2020/eksternal/anakhebat/Slide431-cr-500x500.JPG,https://www.solusibuku.com/agama/let-s-hijrah-and-then-salihah-karena-hijrah-bukan-sekadar-tren-berhijab-mewah.html
