,nama,harga,deskripsi,detail,link gambar,link
108,Di Bawah Naungan Sayap Malaikat Tuhan  Doa & Devosi Katolik,"Rp.32,000 ","
          Sejak masa anak-anak sampai pada kematiannya, malaikat-malaikat mengelilingi kehidupan manusia dengan perlindungan dan doa permohonan ""Seorang malaikat mendampingi setiap orang beriman sebagai pelindung dan gembala, supaya menghantarnya kepada kehidupan"" (Basilius, Eun. 3, 1). Sejak di dunia ini, dalam iman, kehidupan Kristen mengambil bagian di dalam kebahagiaan persekutuan para malaikat dan manusia yang bersatu dalam Allah (Katekismus Gereja Katolik 336). Materi dalam buku ini berupa selayang pandang tentang malaikat (Malaikat dalam kitab suci, Perjanjian Lama dan Perjanjian Baru, Malaikat Agung, Malaikat menurut Katekismus); doa-doa Devosi, Litani dan Novena bersama para malaikat; dan doa-doa untuk orang yang telah meninggal dunia. Dalam buku ini juga disertai juga tentang penjelasan apa itu Surga, Neraka, dan Api Penyucian. Doa-doa bagi orang yang sudah meninggal dunia dan bagi jiwa-jiwa malang di Api Penyucian.        ","{'Kategori': 'Agama', 'Penyunting': 'Tim Penyunting', 'Ketebalan': '92 halaman', 'Dimensi': '12.5x18.5 cm', 'Bahasa': 'bahasa indonesia', 'Stock': 'Out of Stock', 'Penerbit': 'New Vita Pustaka', 'Penulis': 'Tim New Vita Pustaka', 'Berat': '500 gram', 'Product Tags': ' \nagama\nbuku agama\nnew vita pustaka\ntim new vita pustaka\n\n'}",https://www.solusibuku.com/image/c/data/produk/2019/Slide120-cr-500x500.jpeg,https://www.solusibuku.com/agama/di-bawah-naungan-sayap-malaikat-tuhan-doa-devosi-katolik.html
109,Khalid Bin Walid  Panglima Perang yang Tak Terkalahkan,"Rp.46,400 ","
          Buku ini mengupas salah satu pejuang Muslim hebat dalam melaksanakan penyebaran dakwah Islam di seluruh Jazirah Arab, negeri-negeri Persia, Syam, dan yang lainnya. Namanya sangat masyhur dalam catatan sejarah. Ia dikenal sebagai “Pedang Allah yang terhunus” untuk melawan orang-orang murtad dan memusuhi Allah. Dialah Khalid, putra Al-Walid bin Al-Mughirah.        ","{'Kategori': 'Agama', 'Penyunting': 'Tim Penyunting', 'Ketebalan': '264 halaman', 'Dimensi': '14x20.5 cm', 'Bahasa': 'bahasa indonesia', 'Stock': 'Tersedia', 'Penerbit': 'Araska Publisher', 'Penulis': 'Junaidi Ahmad', 'Berat': '500 gram', 'Product Tags': ' \nagama\naraska publisher\nbuku agama\njunaidi ahmad\n\n'}",https://www.solusibuku.com/image/c/data/produk/2019/Slide122-cr-500x500.jpeg,https://www.solusibuku.com/agama/khalid-bin-walid-panglima-perang-yang-tak-terkalahkan.html
110,Seni Mendahsyatkan Hidup  55 Nasihat Untuk Hidup Lebih Bermakna,"Rp.49,600 ","
          Berisi ulasan dan ajakan untuk mengubah cara pandang sehingga kita bisa lebih bijaksana dalam menyikapi kehidupan beserta tantangannya. Renungan dan sentilan yang disisipkan dalam buku ini akan membantu kita dalam berproses menciptakan hidup yang dahsyat yang penuh dengan nilai-nilai Islami.        ","{'Kategori': 'Agama', 'Penyunting': 'Tim Penyunting', 'Ketebalan': '236 halaman', 'Dimensi': '13.5x20.5 cm', 'Bahasa': 'bahasa indonesia', 'Stock': 'Tersedia', 'Penerbit': 'Checklist', 'Penulis': 'Mhd. Rois Almaududy', 'Berat': '500 gram', 'Product Tags': ' \nagama\nbuku agama\nchecklist\nmhd rois almaududy\n\n'}",https://www.solusibuku.com/image/c/data/produk/2019/Slide129-cr-500x500.jpeg,https://www.solusibuku.com/agama/seni-mendahsyatkan-hidup-55-nasihat-untuk-hidup-lebih-bermakna.html
111,Alangkah Bijaknya Nabi Saw Mendidik Anak,"Rp.47,200 ","
          Semua orang tua tentu ingin melihat anak-anaknya tumbuh cerdas, pintar, saleh, dan sukses. Demi tujuan tersebut, berbagai cara pun dilakukan. Namun, di zaman modern ini, tantangan mendidik anak pun terasa kian berat. Apalagi ditambah pengaruh buruk media serta lingkungan pergaulan yang sudah “tergores” oleh budaya barat, hal ini tentu membutuhkan peran penting orang tua dalam mendidik anak-anaknya.
 Namun, jangan khawatir, hadirnya buku ini MENJADI SOLUSI untuk mengantarkan anak Anda menjadi anak yang cerdas, pintar, saleh, dan sukses, melalui pendidikan yang diterapkan oleh Baginda Nabi Muhammad Saw. 
 Rasulullah Saw. –yang segala perbuatannya merupakan perwujudan dari pesan-pesan luhur Al-Qur’an– merupakan pendidik yang sangat sukses dalam membina, membesarkan, dan mendidik anak-anaknya. Lalu, bagaimanakah metode Nabi Muhammad Saw. dalam mendidik anak-anaknya? Temukan jawabannya dalam buku ini. 
 Bonus 9 tips agar anak tidak kecanduan gadget.        ","{'Kategori': 'Agama', 'Penyunting': 'Tim Penyunting', 'Ketebalan': '256 halaman', 'Dimensi': '14x20.5 cm', 'Bahasa': 'bahasa indonesia', 'Stock': 'Tersedia', 'Penerbit': 'Semesta Hikmah Publishing', 'Penulis': 'M. Irsyad, S.Pd.I, M.Pd.I', 'Berat': '500 gram', 'Product Tags': ' \nagama\nbuku agama\nm irsyad spdi mpdi\nsemesta hikmah publishing\n\n'}",https://www.solusibuku.com/image/c/data/produk/2019/Slide131-cr-500x500.jpeg,https://www.solusibuku.com/agama/alangkah-bijaknya-nabi-saw-mendidik-anak.html
112,La Tahzan Ya Habibi,"Rp.38,400 ","
          Buku ini secara umum akan mengajak pembaca untuk menyudahi kesedihan dengan mencari cahaya indah agar dapat membuat kita tersenyum. Secara khusus, buku ini akan mengajak para pembaca yang masih dalam masa penantian untuk menemukan jodohnya, kekasih hatinya, untuk selalu kuat dalam menghadapi cobaan dan ujian.        ","{'Kategori': 'Agama', 'Penyunting': 'Tim Penyunting', 'Ketebalan': '224 halaman', 'Dimensi': '14x20 cm', 'Bahasa': 'bahasa indonesia', 'Stock': 'Tersedia', 'Penerbit': 'Araska Publisher', 'Penulis': 'Assyabia Nur Ariffah', 'Berat': '500 gram', 'Product Tags': ' \nagama\naraska publisher\nassyabia nur ariffah\nbuku agama\n\n'}",https://www.solusibuku.com/image/c/data/produk/2019/Slide134-cr-500x500.jpeg,https://www.solusibuku.com/agama/la-tahzan-ya-habibi.html
113,26 Nasihat Bijak Untuk Suami,"Rp.36,400 ","
          Buku ini berisi uraian detil demi detil urusan rumah tangga, kaitannya dengan tugas suami terhadap istri dan permasalahan-permasalahan yang melingkupinya. Semuanya dijawab dengan nasihat solutif. Banyak cara untuk menyelesaikan masalah. Dan semua solusi ini didasarkan pada ajaran Rasulullah Saw., manager terhebat serta suami paling ideal sepanjang masa disertai pengalaman penulis dalam berumah tangga sebagai seorang suami.
 Pada bagian akhir, pembaca akan menemukan kisah-kisah teladan tentang berumah tangga dari sahabat Rasulullah dan ahlul baitnya. Kisah-kisah ini akan memberikan inspirasi sekaligus introspeksi bagi seorang suami, untuk menciptakan rumah tangga surgawi.        ","{'Kategori': 'Agama', 'Penyunting': 'Tim Penyunting', 'Ketebalan': '182 halaman', 'Dimensi': '14x20 cm', 'Bahasa': 'bahasa indonesia', 'Stock': 'Tersedia', 'Penerbit': 'Semesta Hikmah Publishing', 'Penulis': 'Miftahul Asror Malik', 'Berat': '500 gram', 'Product Tags': ' \nagama\nbuku agama\nmiftahul asror malik\nsemesta hikmah publishing\n\n'}",https://www.solusibuku.com/image/c/data/produk/2019/Slide142-cr-500x500.jpeg,https://www.solusibuku.com/agama/26-nasihat-bijak-untuk-suami.html
114,The Miracle Of Al Fatihah  Ayat Kursi & Al Waqiah,"Rp.37,600 ","
          Alquran dalam praktik kehidupan sehari-hari bukan hanya sebatas bacaaan wajib bagi umat Islam, tetapi juga untuk memenuhi kebutuhan umat Islam itu sendiri. Buku yang hadir di hadapan pembaca ini, sengaja disuguhkan untuk menawarkan solusi dari berbagai permasalahan yang kerap menimpa kita, baik permasalahan bisnis, karir, rezeki, jodoh, kesuksesan hidup, dan lain sebagainya, melalui mengamalkan bacaan surat dan ayat Alquran.        ","{'Kategori': 'Agama', 'Penyunting': 'Tim Penyunting', 'Ketebalan': '211 halaman', 'Dimensi': '14x20 cm', 'Bahasa': 'bahasa indonesia', 'Stock': 'Tersedia', 'Penerbit': 'Araska Publisher', 'Penulis': 'Ramadlan Al-Malawi', 'Berat': '500 gram', 'Product Tags': ' \nagama\naraska publisher\nbuku agama\nramadlan al-malawi\n\n'}",https://www.solusibuku.com/image/c/data/produk/2019/Slide143-cr-500x500.jpeg,https://www.solusibuku.com/agama/the-miracle-of-al-fatihah-ayat-kursi-al-waqiah.html
115,Rahasia Dahsyat Keajaiban Doa Istri,"Rp.38,400 ","
          Buku ini mengulas tentang kekuatan dahsyat seorang istri yang mana mampu mendukung dan menunjang kesuksesan suaminya. Bukan hanya itu, buku ini juga mengulas bagaimana seorang istri yang salihah dapat menjadi sumber kebahagian keluarganya. Dilengkapi segudang doa dan amalan yang mampu membantu kesuksesan diri sendiri, suami dan seluruh keluarga, membuka pintu rezeki yang berlimpah dan juga kebahagiaan rumah tangga.        ","{'Kategori': 'Agama', 'Penyunting': 'Tim Penyunting', 'Ketebalan': '228 halaman', 'Dimensi': '14x20 cm', 'Bahasa': 'bahasa indonesia', 'Stock': 'Tersedia', 'Penerbit': 'Araska Publisher', 'Penulis': 'M.Wifaqul Idaini & Muclasal-Farbi', 'Berat': '500 gram', 'Product Tags': ' \nagama\naraska publisher\nbuku agama\nmwifaqul idaini & muclasal-farbi\n\n'}",https://www.solusibuku.com/image/c/data/produk/2019/Slide144-cr-500x500.jpeg,https://www.solusibuku.com/agama/rahasia-dahsyat-keajaiban-doa-istri.html
116,Detik Detik Menjelang Hisab,"Rp.38,400 ","
          Buku ini secara umum mengkaji detik-detik menjelang hisab dan juga apa yang akan kita peroleh setelah hisab. Dengan demikian, buku ini akan mempertanyakan kepada diri kita, apa saja yang telah kita persiapkan untuk menghadapi kematian sampai Hari Perhitungan? Apakah sudah ada amal saleh yang bakal menjadi bekal kita? Ataukah kita masih bersuntuk-suntuk dengan maksiat dan dosa?        ","{'Kategori': 'Agama', 'Penyunting': 'Tim Penyunting', 'Ketebalan': '216 halaman', 'Dimensi': '14x20 cm', 'Bahasa': 'bahasa indonesia', 'Stock': 'Tersedia', 'Penerbit': 'Araska Publisher', 'Penulis': 'Junaidi Ahmad', 'Berat': '500 gram', 'Product Tags': ' \nagama\naraska publisher\nbuku agama\njunaidi ahmad\n\n'}",https://www.solusibuku.com/image/c/data/produk/2019/Slide147-cr-500x500.jpeg,https://www.solusibuku.com/agama/detik-detik-menjelang-hisab.html
117,Menjadi Istri & Suami Dambaan Surga,"Rp.38,400 ","
          Buku ini mengupas tentang pernikahan dalam Islam di mana istri dan suami melandasi hubungan mereka dengan Alquran-hadis, semangat keseimbangan, menegakkan keadilan, menebar kasih sayang, dan lebih mendahulukan dalam menunaikan kewajiban daripada menuntut hak. Penyajian itu untuk mewujudkan pernikahan yang bertujuan utama untuk mendapatkan ketenteraman, kebahagiaan serta rida dari Allah Swt..        ","{'Kategori': 'Agama', 'Penyunting': 'Tim Penyunting', 'Ketebalan': '228 halaman', 'Dimensi': '14x20 cm', 'Bahasa': 'bahasa indonesia', 'Stock': 'Tersedia', 'Penerbit': 'Araska Publisher', 'Penulis': 'Ahya Alfi Shobari', 'Berat': '500 gram', 'Product Tags': ' \nagama\nahya alfi shobari\naraska publisher\nbuku agama\n\n'}",https://www.solusibuku.com/image/c/data/produk/2019/Slide153-cr-500x500.jpeg,https://www.solusibuku.com/agama/menjadi-istri-suami-dambaan-surga.html
118,4 Kunci Menarik Rezeki,"Rp.41,600 ","
          Buku ini menginspirasi sekaligus memotivasi untuk selalu bersemangat setiap hari dalam menjemput rezeki. Mengupas secara tuntas mengenai hal-hal yang berkaitan dengan seputar rezeki, yaitu mulai dari menjemput rezeki dibawah hangatnya pagi, menggapai rezeki dengan kekuatan istiqomah, dan cara menyingkirkan penghalang turunya rezeki.        ","{'Kategori': 'Agama', 'Penyunting': 'Tim Penyunting', 'Ketebalan': '168 halaman', 'Dimensi': '14.5x22 cm', 'Bahasa': 'bahasa indonesia', 'Stock': 'Tersedia', 'Penerbit': 'Syalmahat', 'Penulis': 'Akbar Syamsul Arifin M.P.D.I', 'Berat': '500 gram', 'Product Tags': ' \nagama\nakbar syamsul arifin mpdi\nbuku agama\nsyalmahat\n\n'}",https://www.solusibuku.com/image/c/data/produk/2019/Slide155-cr-500x500.jpeg,https://www.solusibuku.com/agama/4-kunci-menarik-rezeki.html
119,Cerdas Seketika  Berkah Ilmu Laduni,"Rp.36,000 ","
          Buku ini menginspirasi sekaligus memotivasi untuk selalu bersemangat setiap hari dalam menjemput rezeki. Mengupas secara tuntas mengenai hal-hal yang berkaitan dengan seputar rezeki, yaitu mulai dari menjemput rezeki dibawah hangatnya pagi, menggapai rezeki dengan kekuatan istiqomah, dan cara menyingkirkan penghalang turunya rezeki.        ","{'Kategori': 'Agama', 'Penyunting': 'Tim Penyunting', 'Ketebalan': '174 halaman', 'Dimensi': '14x20 cm', 'Bahasa': 'bahasa indonesia', 'Stock': 'Tersedia', 'Penerbit': 'Semesta Hikmah Publishing', 'Penulis': 'Rizem Aizid', 'Berat': '500 gram', 'Product Tags': ' \nagama\nbuku agama\nrizem aizid\nsemesta hikmah publishing\n\n'}",https://www.solusibuku.com/image/c/data/produk/2019/Slide156-cr-500x500.jpeg,https://www.solusibuku.com/agama/cerdas-seketika-berkah-ilmu-laduni.html
120,The Miracle Of Tahajud & Dhuha,"Rp.38,400 ","
          Buku kecil ini secara khusus membahas dan mengupas rahasia kebanjiran rezeki berkah melalui salat Tahajud dan salat Dhuha. Dengan memahami kedua jenis salat sunnah tersebut dan mengamalkan selayaknya amalan sunnah maka diharapkan akan membuka tabir keberkahan rezeki kita yang masih tertutup dan akhirnya kita kebanjiran rezeki yang berkah dunia akhirat.        ","{'Kategori': 'Agama', 'Penyunting': 'Tim Penyunting', 'Ketebalan': '224 halaman', 'Dimensi': '14x20 cm', 'Bahasa': 'bahasa indonesia', 'Stock': 'Tersedia', 'Penerbit': 'Araska Publisher', 'Penulis': 'Muchlas Al Farabi', 'Berat': '500 gram', 'Product Tags': ' \nagama\naraska publisher\nbuku agama\nmuchlas al farabi\n\n'}",https://www.solusibuku.com/image/c/data/produk/2019/Slide159-cr-500x500.jpeg,https://www.solusibuku.com/agama/the-miracle-of-tahajud-dhuha.html
121,Dahsyatnya Keajaiban Tahajud  Dhuha & Istikharah,"Rp.38,400 ","
          Buku ini memandu kita dalam menyelesaikan berbagai macam masalah, yakni dengan Shalat Tahajud, Shalat Dhuha, dan Shalat Istikharah. Disampaikan secara lugas dan mudah dipahami maka buku ini akan menuntun kita mendekatkan diri kepada Allah Swt. agar diberi pertolongan dalam menyelesaikan berbagai masalah yang kita alami.        ","{'Kategori': 'Agama', 'Penyunting': 'Tim Penyunting', 'Ketebalan': '208 halaman', 'Dimensi': '14x20 cm', 'Bahasa': 'bahasa indonesia', 'Stock': 'Tersedia', 'Penerbit': 'Araska Publisher', 'Penulis': 'Muchlas Al Farabi', 'Berat': '500 gram', 'Product Tags': ' \nagama\naraska publisher\nbuku agama\nmuchlas al farabi\n\n'}",https://www.solusibuku.com/image/c/data/produk/2019/Slide168-cr-500x500.jpeg,https://www.solusibuku.com/agama/dahsyatnya-keajaiban-tahajud-dhuha-istikharah.html
122,Menikah Lillah  Menikah Berkah,"Rp.54,400 ","
          Buku ini membahas pernikahan dan pembentukan rumah tangga yang sesuai dengan ajaran Islam. Argumentasi dan penjelasan yang ada di dalamnya dikuatkan dengan ayat-ayat Al-Qur’an dan hadits. Dilengkapi pula dengan pengalaman penulis yang diharapkan dapat menjadi pelajaran berharga bagi para pembaca.        ","{'Kategori': 'Agama', 'Penyunting': 'Tim Penyunting', 'Ketebalan': '266 halaman', 'Dimensi': '14x20 cm', 'Bahasa': 'bahasa indonesia', 'Stock': 'Tersedia', 'Penerbit': 'Checklist', 'Penulis': 'Haidar Musyafa', 'Berat': '500 gram', 'Product Tags': ' \nagama\nbuku agama\nchecklist\nhaidar musyafa\n\n'}",https://www.solusibuku.com/image/c/data/produk/2019/Slide171-cr-500x500.jpeg,https://www.solusibuku.com/agama/menikah-lillah-menikah-berkah.html
123,Menjadi Muslimah Bahagia Dunia Akhirat,"Rp.38,400 ","
          Buku ini menyajikan rahasia di balik amalan ringan yang berpahala besar, antara lain salat sunah berpahala besar, puasa-puasa sunah berpahala besar, zikir-zikir ringan berpahala besar dan juga amalan-amalan ringan yang sangat mudah dilakukan oleh para muslimah.        ","{'Kategori': 'Agama', 'Penyunting': 'Tim Penyunting', 'Ketebalan': '212 halaman', 'Dimensi': '14x20 cm', 'Bahasa': 'bahasa indonesia', 'Stock': 'Tersedia', 'Penerbit': 'Araska Publisher', 'Penulis': 'Mansur Aliman', 'Berat': '500 gram', 'Product Tags': ' \nagama\naraska publisher\nbuku agama\nmansur aliman\n\n'}",https://www.solusibuku.com/image/c/data/produk/2019/Slide173-cr-500x500.jpeg,https://www.solusibuku.com/agama/menjadi-muslimah-bahagia-dunia-akhirat.html
124,Ya Allah  Ajari Aku Bertobat,"Rp.53,200 ","
          Buku ini membahas masalah tobat dan perkara-perkara yang terkait dengannya. Pembahasan dimulai dengan jenis-jenis dosa, dosa yang harus dimintakan tobat kepada Allah SWT, balasan seperti apa yang akan diterima pelaku dosa jika tidak bertobat, dan kemudian membahas masalah tobat serta hal-hal yang terkait dengan tobat itu sendiri.        ","{'Kategori': 'Agama', 'Penyunting': 'Tim Penyunting', 'Ketebalan': '250 halaman', 'Dimensi': '14x20 cm', 'Bahasa': 'bahasa indonesia', 'Stock': 'Tersedia', 'Penerbit': 'Checklist', 'Penulis': 'Haidar Musyafa', 'Berat': '500 gram', 'Product Tags': ' \nagama\nbuku agama\nchecklist\nhaidar musyafa\n\n'}",https://www.solusibuku.com/image/c/data/produk/2019/Slide195-cr-500x500.jpeg,https://www.solusibuku.com/agama/ya-allah-ajari-aku-bertobat.html
125,337 Tanya Jawab Fiqih Wanita,"Rp.47,200 ","
          Buku ini memuat 337 masalah agama, mengupas berbagai persoalan wanita kekinian, mulai dari masalah jilbab, salat, ziarah kubur, puasa, zakat, haji, kurban, akikah, hingga perkawinan dan masalah-masalah lainnya. Dijawab secara langsung dengan rujukan dalil yang sesuai dengan paham ahli sunnah wal jama’ah. Sangat penting dimiliki bagi para wanita untuk menjadikan dirinya wanita salihah “mutiara yang indah” di tengah-tengah godaan dan tantangan zaman yang kian mengerikan. 
 Perkembangan zaman yang kian kompleks menjadikan para wanita harus lebih kuat dalam menjaga imannya dan tetap memegang teguh ajaran-ajaran agama Islam, sebagaimana ungkapan dalam hadis, “Gigitlah ajaran Islam ini dengan gigi geraham!” Karena hal inilah satu-satunya jalan untuk menyelamatkan wanita dari gelombang kehidupan dunia yang melalaikan. 
 Selamat membaca dan semoga bermanfaat!        ","{'Kategori': 'Agama', 'Penyunting': 'Tim Penyunting', 'Ketebalan': '222 halaman', 'Dimensi': '14x20 cm', 'Bahasa': 'bahasa indonesia', 'Stock': 'Tersedia', 'Penerbit': 'Semesta Hikmah Publishing', 'Penulis': 'Ust. Abdullah Al-Marwi', 'Berat': '500 gram', 'Product Tags': ' \nagama\nbuku agama\nsemesta hikmah publishing\nust abdullah al-marwi\n\n'}",https://www.solusibuku.com/image/c/data/produk/2019/Slide206-cr-500x500.jpeg,https://www.solusibuku.com/agama/337-tanya-jawab-fiqih-wanita.html
126,Agar Anak Zaman Now Bisa Hafal Al Quran,"Rp.30,400 ","
          ini berisi tips-tips praktis agar anak “zaman now” mencintai dan bisa menghafal Al-Qur’an dengan mudah sejak dini. Setelah melakukan penelitian, penulis buku ini menyadari bahwasanya menghafal Al-Qur’an sejak dini sesungguhnya bukanlah hal yang sulit dan malah lebih mudah melakukannya. 
 Oleh karena itu, amat disayangkan bila buku ini tidak dibagikan kepada masyarakat agar semua bisa membaca dan mengamalkannya. Sehingga, akan semakin banyak keluarga yang mampu menghafal Al-Qur’an. Selain untuk menjaga keutuhan Al-Qur’an, juga menjadi bentuk perwujudan cinta kepada Al-Qur’an.        ","{'Kategori': 'Agama', 'Penyunting': 'Tim Penyunting', 'Ketebalan': '128 halaman', 'Dimensi': '14x20 cm', 'Bahasa': 'bahasa indonesia', 'Stock': 'Tersedia', 'Penerbit': 'Semesta Hikmah Publishing', 'Penulis': 'Nurul Q, M.Pd.I & M.Irsyad, M.Pd.I', 'Berat': '500 gram', 'Product Tags': ' \nagama\nbuku agama\nnurul q mpdi & mirsyad mpdi\nsemesta hikmah publishing\n\n'}",https://www.solusibuku.com/image/c/data/produk/2019/Slide207-cr-500x500.jpeg,https://www.solusibuku.com/agama/agar-anak-zaman-now-bisa-hafal-al-quran.html
127,La Tahzan For Jomblo Fisabilillah,"Rp.39,200 ","
          Buku ini menyajikan bagaimana mengisi masa Jomblo dengan beramal ibadah di jalan Allah. Pembaca akan dipandu untuk tidak berkecil hati kalau masih jomblo. Apalagi sampai patah hati dan sampai ingin bunuh diri segala. Sebab, di buku ini akan dibuka bahwa dunia jomblo pun tak kalah indahnya.        ","{'Kategori': 'Agama', 'Penyunting': 'Tim Penyunting', 'Ketebalan': '224 halaman', 'Dimensi': '14x20 cm', 'Bahasa': 'bahasa indonesia', 'Stock': 'Tersedia', 'Penerbit': 'Araska Publisher', 'Penulis': 'Zahra Zahira S.', 'Berat': '500 gram', 'Product Tags': ' \nagama\naraska publisher\nbuku agama\nzahra zahira s\n\n'}",https://www.solusibuku.com/image/c/data/produk/2019/Slide209-cr-500x500.jpeg,https://www.solusibuku.com/agama/la-tahzan-for-jomblo-fisabilillah.html
128,Kitab Panduan Shalat Praktis & Lengkap,"Rp.143,200","
          Buku ini berisi panduan praktis shalat yang disusun secara lengkap, mencakup berbagai materi penting dan materi tambahan tentang shalat. Beberapa doa dan bacaan yang ada dalam buku ini dilengkapi dengan terjemahan per kata sehingga para pembaca bisa memahami bacaan yang diucapkannya saat shalat. Harapannya, ibadah shalat para pembaca sekalian semakin khusyuk dan sempurna.        ","{'Kategori': 'Agama', 'Penyunting': 'Tim Penyunting', 'Ketebalan': '456 halaman', 'Dimensi': '15x23 cm', 'Bahasa': 'bahasa indonesia', 'Stock': 'Tersedia', 'Penerbit': 'Checklist', 'Penulis': 'Ust. Junaidi & Megah T, S.Pd', 'Berat': '500 gram', 'Product Tags': ' \nagama\nbuku agama\nchecklist\nust junaidi & megah t spd\n\n'}",https://www.solusibuku.com/image/c/data/produk/2019/Slide210-cr-500x500.jpeg,https://www.solusibuku.com/agama/kitab-panduan-shalat-praktis-lengkap.html
129,Menjadi Istri yang Selalu Ditolong Allah & Surga Bagi Suami,"Rp.39,200 ","
          Buku ini secara umum akan mengupas bagaimana seorang istri agar selalu mendapat pertolongan dari Allah Subhanahu wa taala dan juga menjadi surga bagi suaminya. Disajikan ibadah-ibadah untuk mendapat rida Allah dan ibadah-ibadah yang dapat membahagiakan suami.        ","{'Kategori': 'Agama', 'Penyunting': 'Tim Penyunting', 'Ketebalan': '227 halaman', 'Dimensi': '14x20 cm', 'Bahasa': 'bahasa indonesia', 'Stock': 'Tersedia', 'Penerbit': 'Araska Publisher', 'Penulis': 'Nafisah Zulkarnain', 'Berat': '500 gram', 'Product Tags': ' \nagama\naraska publisher\nbuku agama\nnafisah zulkarnain\n\n'}",https://www.solusibuku.com/image/c/data/produk/2019/Slide219-cr-500x500.jpeg,https://www.solusibuku.com/agama/menjadi-istri-yang-selalu-ditolong-allah-surga-bagi-suami.html
130,88 Strategi Bisnis Ala Rasulullah yang Tak Pernah Rugi,"Rp.45,600 ","
          Buku ini berisi 88 strategi bisnis ala Rasulullah saw., yang dijamin tidak akan rugi dunia maupun akhirat. Jadi, sangat tepat dibaca oleh pengusaha kaum muslim untuk untung di dunia dan juga untung di akhirat.        ","{'Kategori': 'Agama', 'Penyunting': 'Tim Penyunting', 'Ketebalan': '252 halaman', 'Dimensi': '14x20 cm', 'Bahasa': 'bahasa indonesia', 'Stock': 'Tersedia', 'Penerbit': 'Araska Publisher', 'Penulis': 'Ahmad Jarifin', 'Berat': '500 gram', 'Product Tags': ' \nagama\nahmad jarifin\naraska publisher\nbuku agama\n\n'}",https://www.solusibuku.com/image/c/data/produk/2019/Slide229-cr-500x500.jpeg,https://www.solusibuku.com/agama/88-strategi-bisnis-ala-rasulullah-yang-tak-pernah-rugi.html
131,Laki Laki Yang Tak Berhenti Menangis,"Rp.44,800 ","
          Laki-Laki yang Tak Berhenti Menangis berisi kumpulan kisah-kisah yang tak hanya menyejukkan hati melainkan mengajak manusia untuk berserah diri kepada-Nya.        ","{'Kategori': 'Agama', 'Penyunting': 'Tim Penyunting', 'Ketebalan': '115 halaman', 'Dimensi': '14 x 20 cm', 'Bahasa': 'bahasa indonesia', 'Stock': 'Tersedia', 'Berat': '500 gram', 'Product Tags': ' \nagama\nbuku agama\nbuku mojok\nrusdi matahari\n\n'}",https://www.solusibuku.com/image/c/data/produk/eksternal/Slide051-cr-500x500.jpeg,https://www.solusibuku.com/agama/laki-laki-yang-tak-berhenti-menangis.html
132,Muslimah Yang Diperdebatkan,"Rp.62,400 ","
          Buku ini berisi tentang pemikiran, perenungan, sekaligus curahan hari seorang perempuan. Buku ini hanya berupaya memberikan dukungan kepada suara perempuan yang sering kali gagal didengar dan dipahami karena hukum halal-haram selalu dijatuhkan terlebih dahulu dibanding aspirasi dan pengalaman perempuan. Narasi yang ditulis Kalis dalam buku ini berfokus pada tubuh,  kemanusiaan, religiusitas dan berbagai pengalaman perempuan lainnya.        ","{'Kategori': 'Agama', 'Penyunting': 'Tim Penyunting', 'Ketebalan': ' 14 halaman', 'Dimensi': '14 x 20 cm', 'Bahasa': 'bahasa indonesia', 'Stock': 'Tersedia', 'Penerbit': 'Buku Mojok', 'Penulis': 'A.R. Shohibul Ulum', 'Berat': '300 gram', 'Product Tags': ' \nagama\nbuku agama\nbuku mojok\nkalis mardiasih\n\n'}",https://www.solusibuku.com/image/c/data/produk/2019/agustus/Slide03-cr-500x500.jpeg,https://www.solusibuku.com/agama/muslimah-yang-diperdebatkan.html
133,Salah Kaprah  Shalat  Puasa  Sedekah Dan Doa,"Rp.42,000 ","
          Buku ini berisi memperbaiki berbagai kebiasaan keliru dalam ibadah yang dianggap benar padahal salah. Baik ibadah shalat, puasa, sedekah, dan doa. Kebiasaan keliru tersebut bisa menjadi penyebab ibadah yang ditolak, rezeki seret, dan hidup ruwet. Oleh karena itu, buku ini hadir agar dapat menjadi pedoman kaum muslimin dalam memperbaiki kesalahan dalam beribadah.        ","{'Kategori': 'Agama', 'Penyunting': 'Tim Penyunting', 'Ketebalan': '201 Halaman', 'Dimensi': '14.5 x 21 cm', 'Bahasa': 'bahasa indonesia', 'Stock': 'Tersedia', 'Penerbit': 'Nur Media', 'Penulis': 'Rizem Aizid', 'Berat': '300 gram', 'Product Tags': ' \nagama\nbuku agama\nnur media\nrizem aizid\n\n'}",https://www.solusibuku.com/image/c/data/produk/2019/juli/Slide01-cr-500x500.jpeg,https://www.solusibuku.com/agama/salah-kaprah-shalat-puasa-sedekah-dan-doa.html
