,nama,harga,deskripsi,detail,link gambar,link
0,Kamuflase Dosa,"Rp.46,000 ","
          Buku mengajak kita untuk anda mengintrospeksi diri tentang tingkah laku manusia sehari-hari. Ada 54 tulian tentang introspeksi diri yang ditulis dalam buku ini.        ","{'Kategori': 'Agama', 'Penyunting': 'Tim Penyunting', 'Ketebalan': '186 halaman', 'Dimensi': '14x20.5 cm', 'Bahasa': 'bahasa indonesia', 'Stock': 'Tersedia', 'Penerbit': 'An-Najaa Muslim Media', 'Penulis': 'M. Nur Kholis Al Amin', 'Berat': '300 gram', 'Product Tags': ' \nagama\nan-najaa muslim media\nbuku agama\nm nur kholis al amin\n\n'}",https://www.solusibuku.com/image/c/data/produk/2017/Slide003-cr-500x500.jpeg,https://www.solusibuku.com/agama/kamuflase-dosa.html
1,Dahsyatnya Perjalanan Kehidupan Manusia,"Rp.48,000 ","
          Ungkapan ""Urip Kuwi Mung Mampir Ngombe"", mengisyaratkan kepada kita sebagai manusia supaya tidak terlena dengan kehiduapan dunia, tetapi harus selalu 'eling' atau ingat akan kehiduapan setelah mati, agar kita bisa menyiapakan bekal cukup untuk kehidupan di akhirat.        ","{'Kategori': 'Agama', 'Penyunting': 'Tim Penyunting', 'Ketebalan': '214 halaman', 'Dimensi': '14x20.5 cm', 'Bahasa': 'bahasa indonesia', 'Stock': 'Tersedia', 'Penerbit': 'An-Najaa Muslim Media', 'Penulis': 'M. Nur Kholis Al Amin Dkk', 'Berat': '300 gram', 'Product Tags': ' \nagama\nan-najaa muslim media\nbuku agama\nm nur kholis al amin dkk\n\n'}",https://www.solusibuku.com/image/c/data/produk/2017/Slide004-cr-500x500.jpeg,https://www.solusibuku.com/agama/dahsyatnya-perjalanan-kehidupan-manusia.html
2,Edisi Revisi La Tahzan Untuk Para Pencari Jodoh,"Rp.34,800 ","
          Kisah cinta antara kaum adam dan kaum hawa selalau mengandung rahasia yang tidak dapat diterka sebelum terjadi menjadi fakta. Allah merahasiakan siapa yang akan menjadi jodoh kita sampai pada akhirnya kita memahami bahwa seseorag adalah jodoh kita.Nah, untuk itu hadirlah buku ini sebagai salah satu referensi ilmu dan ajaran islam dalam hal mencari jodoh. Dalam buku ini berisi doa-doa untuk mendekatka Jodoh, Amalan agar Cepat Mendapatkan Jodoh, Cara mendapatkan Jodoh secara Islami, dan 10 Pesan Penuh Kemuliaan daroi Aidh Al-Qarni.        ","{'Kategori': 'Agama', 'Penyunting': 'Tim Penyunting', 'Ketebalan': '208 halaman', 'Dimensi': '14x20.5 cm', 'Bahasa': 'bahasa indonesia', 'Stock': 'Tersedia', 'Penerbit': 'Araska Publisher', 'Penulis': 'Riyadhus Shalihin Emka', 'Berat': '300 gram', 'Product Tags': ' \nagama\naraska publisher\nbuku agama\nriyadhus shalihin emka\n\n'}",https://www.solusibuku.com/image/c/data/produk/2017/Slide011-cr-500x500.jpeg,https://www.solusibuku.com/agama/edisi-revisi-la-tahzan-untuk-para-pencari-jodoh.html
3,Amalan2 Dahsyat Nabi Dari Pagi Hingga Malam Hari,"Rp.34,800 ","
          Buku ini mengupas tentang rahasia hidup berkah dengan amalan pagi dan petang. Selain itu, dilengkapi dengan cara memperoleh mukjizat dan keajaiban amalan pagi, siang, sore, dan malam hari, dan menjalankan sunnah dalam kehidupan sosial. Dengan demikian, hidup penuh berkah dan rezeki melimpah senantiasa menghampiri kita. Selamat membaca!        ","{'Kategori': 'Agama', 'Penyunting': 'Tim Penyunting', 'Ketebalan': '208 halaman', 'Dimensi': '14x20.5 cm', 'Bahasa': 'bahasa indonesia', 'Stock': 'Tersedia', 'Penerbit': 'Araska Publisher', 'Penulis': 'Ahmad Naufil', 'Berat': '300 gram', 'Product Tags': ' \nagama\nahmad naufil\naraska publisher\nbuku agama\n\n'}",https://www.solusibuku.com/image/c/data/produk/2017/Slide039-cr-500x500.jpeg,https://www.solusibuku.com/agama/amalan2-dahsyat-nabi-dari-pagi-hingga-malam-hari.html
4,Hijrah For Muslimah,"Rp.34,800 ","
          Buku terbitan Penerbit Araska ini merupakan buku yang dipertunukan bagi perempuan. Di dalamnya dijelaskan menegai proses hijrahnya seorang perempuan dalam agama Islam.        ","{'Kategori': 'Agama', 'Penyunting': 'Tim Penyunting', 'Ketebalan': '224 halaman', 'Dimensi': '14x20.5 cm', 'Bahasa': 'bahasa indonesia', 'Stock': 'Tersedia', 'Penerbit': 'Araska Publisher', 'Penulis': 'Assyabia Nur Ariffah', 'Berat': '300 gram', 'Product Tags': ' \nagama\naraska publisher\nassyabia nur ariffah\nbuku agama\n\n'}",https://www.solusibuku.com/image/c/data/produk/2017/Slide096-cr-500x500.jpeg,https://www.solusibuku.com/agama/hijrah-for-muslimah.html
5,Nikmat Tuhan Kamu yang Manakah yang Kamu Dustakan,"Rp.35,200 ","
          Buku karya Sabbih Assalawi memberikan kita kecerahan bagi para kaum muslimin untuk selalu bersyukur terhadap apa yang dimiliki hingga saat ini.        ","{'Kategori': 'Agama', 'Penyunting': 'Tim Penyunting', 'Ketebalan': '219 halaman', 'Dimensi': '20x14 cm', 'Bahasa': 'bahasa indonesia', 'Stock': 'Tersedia', 'Penerbit': 'Brilliant Books', 'Penulis': 'Sabbih Assalawi', 'Berat': '300 gram', 'Product Tags': ' \nagama\nbrilliant books\nbuku agama\nsabbih assalawi\n\n'}",https://www.solusibuku.com/image/c/data/produk/2017/Slide161-cr-500x500.jpeg,https://www.solusibuku.com/agama/nikmat-tuhan-kamu-yang-manakah-yang-kamu-dustakan.html
6,Nikmatnya Ibadah Sunah,"Rp.50,400 ","
          Buku ini berisi panduan untuk menjalankan Ibadah Sunnah dalam Islam seperti : Sholat Dhuha,Puasa Senin-Kamis, Puasa Arafah dll. Buku dapat anda jadikan referensi untuk menjadi panduan Ibadah Sunnah anda.        ","{'Kategori': 'Agama', 'Penyunting': 'Tim Penyunting', 'Ketebalan': '260 halaman', 'Dimensi': '20x14 cm', 'Bahasa': 'bahasa indonesia', 'Stock': 'Tersedia', 'Penerbit': 'Checklist', 'Penulis': 'Ratih Rahmawati', 'Berat': '500 gram', 'Product Tags': ' \nagama\nbuku agama\nchecklist\nratih rahmawati\n\n'}",https://www.solusibuku.com/image/c/data/produk/2017/Slide282-cr-500x500.jpeg,https://www.solusibuku.com/agama/nikmatnya-ibadah-sunah.html
7,Praktis & Mudah Kuasai Tajwid,"Rp.57,600 ","
          Berisi materi dan pelajaran tentang tajwid, seperti nama-nama huruf hijaiyah, istilah tanda baca, tempat keluar huruf, bacaan Panjang/mad, qalqalah, dan sebagainya.        ","{'Kategori': 'Agama', 'Penyunting': 'Tim Penyunting', 'Ketebalan': '320 halaman', 'Dimensi': '20.5x14 cm', 'Bahasa': 'bahasa indonesia', 'Stock': 'Tersedia', 'Penerbit': 'Checklist', 'Penulis': 'Rohmattulloh & Megah Tinambun', 'Berat': '500 gram', 'Product Tags': ' \nagama\nbuku agama\nchecklist\nrohmattulloh & megah tinambun\n\n'}",https://www.solusibuku.com/image/c/data/produk/2017/Slide299-cr-500x500.jpeg,https://www.solusibuku.com/agama/praktis-mudah-kuasai-tajwid.html
8,Yakin  Siap Nikah ,"Rp.53,200 ","
          Buku ini berisi ulasan tentang seluk-beluk pernikahan di dalam Islam, mulai dari penjelasan tentang keluarga, tahapan pra-nikah, hal-hal yang perlu dijaga dan dilakukan oleh calon suami/istri, manajemen konflik, manajemen keuangan keluarga, persiapan kehamilan, dan sebagainya. Didukung dengan ilustrasi yang sederhana tapi menarik dan mengena, serta ditulis dengan lugas sehingga enak dibaca. Dilengkapi pula dengan khat Arab untuk mendukung kualitas buku. Dicetak dalam format dual tone, yakni hitam dan merah.        ","{'Kategori': 'Agama', 'Penyunting': 'Tim Penyunting', 'Ketebalan': '276 halaman', 'Dimensi': '20.5x14 cm', 'Bahasa': 'bahasa indonesia', 'Stock': 'Tersedia', 'Penerbit': 'Checklist', 'Penulis': 'Vina Sri', 'Berat': '400 gram', 'Product Tags': ' \nagama\nbuku agama\nchecklist\nvina sri\n\n'}",https://www.solusibuku.com/image/c/data/produk/2017/Slide301-cr-500x500.jpeg,https://www.solusibuku.com/agama/yakin-siap-nikah.html
9,Mujizat Masih Ada,"Rp.31,200 ","
          Buku ini berisi beberapa cerita-cerita Isa Al-Masih dan beberapa ceramah para Pendeta Kristen. Buku ini dapat dijadikan referensi umat Kristiani dalam beribadah.        ","{'Kategori': 'Agama', 'Penyunting': 'Tim Penyunting', 'Ketebalan': '138 halaman', 'Dimensi': '14x21 cm', 'Bahasa': 'bahasa indonesia', 'Stock': 'Tersedia', 'Penerbit': 'Cv. Asfa Solution', 'Penulis': 'Agus Saputra & Pdt. Dominggus Sogalrey, Dip.Bs.', 'Berat': '400 gram', 'Product Tags': ' \nagama\nagus saputra & pdt dominggus sog\nbuku agama\ncv asfa solution\n\n'}",https://www.solusibuku.com/image/c/data/produk/2017/Slide319-cr-500x500.jpeg,https://www.solusibuku.com/agama/mujizat-masih-ada.html
10,Kisah Nyata Membuka Pintu Rezeki Dengan Amalan Sunah,"Rp.34,800 ","
          Ini adalah kumpulan kisah nyata tentang orang yang membuka Pintu Rezeki dengan Amalan Sunnah yang diajarkan dalam agama Islam. Dengan melakukan amalan-amalan ibadaha serta doa-doa yang tealh diajarkan oleh Allah dan Rasulnya dapat mengantarkan kita memperoleh rezeki ketenangan, ketentraman, dan kedamaian di dunia dan akhirat, kebahagian di alam rezeki materi yang dipenuhi keberkahan sesuo dengan apa yang telah dijanjikan oleh Allah SWT dalam Surat An-Nahl 97 yang artinya 'Barang siapa mengerjakan amal shalih, baik laki-laki maupun perempuan dalam keadaa beriman, maka sesungguhnya akan kami berikan kepadanya kehidupan yang baik dan sesungguhnya akan kami beri balasan kepada mereka dengan pahala yang lebih baik dari apa yang telah mereka kerjakan.        ","{'Kategori': 'Agama', 'Penyunting': 'Tim Penyunting', 'Ketebalan': '204 halaman', 'Dimensi': '13.5x20.5 cm', 'Bahasa': 'bahasa indonesia', 'Stock': 'Tersedia', 'Penerbit': 'Dida Pustaka', 'Penulis': 'Jubair Tablig Syahid', 'Berat': '450 gram', 'Product Tags': ' \nagama\nbuku agama\ndida pustaka\njubair tablig syahid\n\n'}",https://www.solusibuku.com/image/c/data/produk/2017/Slide327-cr-500x500.jpeg,https://www.solusibuku.com/agama/kisah-nyata-membuka-pintu-rezeki-dengan-amalan-sunah.html
11,Kisah Nyata Keberkahan Para Pengamal Shalat Dhuha & Tahajud,"Rp.50,000 ","
          Buku karya Aqilah Selma Amalia menjelaskan banyak keberkahan dan pengamal Shalat Dhuha dan Tahajud yang merupakan dua Sholat Sunnah yang paling utama. Cerita-cerita di dalam buku ini adalah kisah nyata yang disusun oleh sang penulis. Dari sekian kisah nyata tersebut ada diantaranya adalah pengalaman dimudahkan rezekinya, diberikan kesehatan dan keselamatan dan didekatkan dengan keberuntungan karena menjalankan Sholat Sunnah Dhuha dan Tahajud.        ","{'Kategori': 'Agama', 'Penyunting': 'Tim Penyunting', 'Ketebalan': '272 halaman', 'Dimensi': '20.5x13.5 cm', 'Bahasa': 'bahasa indonesia', 'Stock': 'Tersedia', 'Penerbit': 'Dida Pustaka', 'Penulis': 'Aqilah Selma Amalia', 'Berat': '300 gram', 'Product Tags': ' \nagama\naqilah selma amalia\nbuku agama\ndida pustaka\n\n'}",https://www.solusibuku.com/image/c/data/produk/2017/Slide334-cr-500x500.jpeg,https://www.solusibuku.com/agama/kisah-nyata-keberkahan-para-pengamal-shalat-dhuha-tahajud.html
12,Doa Anak Muslim Sehari Hari,"Rp.21,600 ","
          Buku ini adalah kumpulan buku doa-doa sehari-hari Anak Sholih-SHOLIHAH ini disusun tak hany untuk selalu mengingat Allah SWT, tetapi juga membiasakan mereka selalu menerapkan kehidupan berdasarkan ajaran agama. Selain beiris doa dalam bahasa Arab, buku juga dilengkapi terjemahan serta tak lupa artinya. Tujuannnya agar anak-anak bisa memahamai doa-doa sehari-hari dengan mudah.        ","{'Kategori': 'Agama', 'Penyunting': 'Tim Penyunting', 'Ketebalan': '80 halaman', 'Dimensi': '18x12.5 cm', 'Bahasa': 'bahasa indonesia', 'Stock': 'Tersedia', 'Penerbit': 'Ecosystem', 'Penulis': 'Drs. Agus Hidayat', 'Berat': '350 gram', 'Product Tags': ' \nagama\nbuku agama\ndrs agus hidayat\necosystem\n\n'}",https://www.solusibuku.com/image/c/data/produk/2017/Slide357-cr-500x500.jpeg,https://www.solusibuku.com/agama/doa-anak-muslim-sehari-hari.html
13,The Meaningful Life With Rumi,"Rp.63,200 ","
          Berisi biografi Jalaluddin Rumi dan kumpulan kearifan Jalaluddin Rumi dari berbagai karyanya. Terdapat beberapa petuah yang dapat menjadi bahan renungan dalam menyelamatkan krisis identitas Ilalah, kebahagiaan, dan tanggung jawab kemanusiaan.        ","{'Kategori': 'Agama', 'Penyunting': 'Tim Penyunting', 'Ketebalan': '224 halaman', 'Dimensi': '14x20 cm', 'Bahasa': 'bahasa indonesia', 'Stock': 'Out of Stock', 'Penerbit': 'Forum Edukasi', 'Penulis': 'Abd. Kholiq', 'Berat': '400 gram', 'Product Tags': ' \nabd kholiq\nagama\nbuku agama\nforum edukasi\n\n'}",https://www.solusibuku.com/image/c/data/produk/2017/Slide392-cr-500x500.jpeg,https://www.solusibuku.com/agama/the-meaningful-life-with-rumi.html
14,Risalah Ibnu Fadhlan,"Rp.54,400 ","
          Buku ini adalah dokumentasi perjalanan ekspedisinya ke wilayah Rusia atas perintah dari Khalifah Al-Muqtadir Billa–para sejarawan menyebutkan bahwa Al-Muqtadir Billah adalah Ja’far bin Al-Khalifah al Mutadhid–dalam kurun waktu selama tiga tahun pada 921 Masehi. Dalam buku ini, Ibnu Fadhlan memberikan laporan yang sangat menarik tentang keadaan daerah yang dilewatinya, meliputi gambaran geogarfi wilayah, kondisi sosial masyarakat, agama dan kepercayaannya, hingga bentuk badan atau wajah bangsa yang dijumpai.        ","{'Kategori': 'Agama', 'Penyunting': 'Tim Penyunting', 'Ketebalan': '200 halaman', 'Dimensi': '20x14 cm', 'Bahasa': 'bahasa indonesia', 'Stock': 'Tersedia', 'Penerbit': 'Forum Edukasi', 'Penulis': 'Ahmad Ibnu Fadhlan', 'Berat': '350 gram', 'Product Tags': ' \nagama\nahmad ibnu fadhlan\nbuku agama\nforum edukasi\n\n'}",https://www.solusibuku.com/image/c/data/produk/2017/Slide395-cr-500x500.jpeg,https://www.solusibuku.com/agama/risalah-ibnu-fadhlan.html
15,Doa & Zikir Harian Ibu Hamil & Menyusui,"Rp.31,200 ","
          Buku terbitan Semesta Hikmah ini merupakan buku yang dikhususkan bagi para Ibu Hamil & Menyusui. Buku ini berisi doa-doa dan zikir untuk para Ibu Hamil dan Menyesui seperti; doa ketika hendak melahirkan, Doa Agar Melanhirkan dengan Lancar, Doa Agar Dikaruniai Anak, Doa Mohon Diberi Keselamatan, Doa Untuk Ibu Hamil, Doa Ibu yang Sedang Menyusui, Doa untuk Ibu Nifas dan sebagainya.        ","{'Kategori': 'Agama', 'Penyunting': 'Tim Penyunting', 'Ketebalan': '196 halaman', 'Dimensi': '12x18 cm', 'Bahasa': 'bahasa indonesia', 'Stock': 'Tersedia', 'Penerbit': 'Semesta Hikmah Publishing', 'Penulis': 'Nur K', 'Berat': '450 gram', 'Product Tags': ' \nagama\nbuku agama\nnur k\nsemesta hikmah publishing\n\n'}",https://www.solusibuku.com/image/c/data/produk/2017/Slide561-cr-500x500.jpeg,https://www.solusibuku.com/agama/doa-zikir-harian-ibu-hamil-menyusui.html
16,105 Wasiat Nabi Saw Untuk Muslimah,"Rp.41,600 ","
          Buku ini berisi 105 nasihat/pesan dari Rasulullah Saw. kepada para muslimah untuk selalu memperbaiki dan meningkatkan kualitas diri. Di dalamnya terdapat 5 tema besar yang mencakup segala aspek kehidupan. Ditulis dengan bahasa yang lugas dan mudah dipahami serta dikupas secara mendetail dan mendalam. In-syaa Allah buku ini akan memperbaiki dan meningkatkan kualitas diri kita –khususnya para muslimah.        ","{'Kategori': 'Agama', 'Penyunting': 'Tim Penyunting', 'Ketebalan': '240 halaman', 'Dimensi': '20.5x14 cm', 'Bahasa': 'bahasa indonesia', 'Stock': 'Tersedia', 'Penerbit': 'Semesta Hikmah Publishing', 'Penulis': 'Mohammad Irsyad, M.Pd.I', 'Berat': '500 gram', 'Product Tags': ' \nagama\nbuku agama\nmohammad irsyad mpdi\nsemesta hikmah publishing\n\n'}",https://www.solusibuku.com/image/c/data/produk/2017/Slide571-cr-500x500.jpeg,https://www.solusibuku.com/agama/105-wasiat-nabi-saw-untuk-muslimah.html
17,Hijrah,"Rp.50,400 ","
          Buku ini berisi tentang proses perjalanan menemukan cahaya Ilahi, Pengalaman spiritual yang sangat berharga, proses hijrah dari dunia hitam menuju ke dunia putih.        ","{'Kategori': 'Agama', 'Penyunting': 'Tim Penyunting', 'Ketebalan': '274 halaman', 'Dimensi': '14x20.5 cm', 'Bahasa': 'bahasa indonesia', 'Stock': 'Tersedia', 'Penerbit': 'Syalmahat Publishing', 'Penulis': 'Ir. Chandra Soensoekarno', 'Berat': '500 gram', 'Product Tags': ' \nagama\nbuku agama\nir chandra soensoekarno\nsyalmahat publishing\n\n'}",https://www.solusibuku.com/image/c/data/produk/2017/Slide580-cr-500x500.jpeg,https://www.solusibuku.com/agama/hijrah.html
18,Kumpulan Doa Istri Untuk Sukses Suami,"Rp.34,000 ","
          Buku ini berisi uraian pentingnya peranan seorang istri dalam membina sebuah keluarga khususnya kepada sang suami agar suami selalu taat kepada Allah Swt., bertanggung jawab kepada keluarga, dan setia serta sayang kepada istri dan anak-anaknya.        ","{'Kategori': 'Agama', 'Penyunting': 'Tim Penyunting', 'Ketebalan': '188 halaman', 'Dimensi': '20.5x14 cm', 'Bahasa': 'bahasa indonesia', 'Stock': 'Tersedia', 'Penerbit': 'Semesta Hikmah Publishing', 'Penulis': 'Ummi Iktafa', 'Berat': '500 gram', 'Product Tags': ' \nagama\nbuku agama\nsemesta hikmah publishing\nummi iktafa\n\n'}",https://www.solusibuku.com/image/c/data/produk/2018/Slide026-cr-500x500.jpeg,https://www.solusibuku.com/agama/kumpulan-doa-istri-untuk-sukses-suami.html
19,40  Kisah Mukjizat Dalam Alkitab,"Rp.43,200 ","
          Dalam buku ini, kita akan menemukan mukjizat yang sangat luar biasa dalam Kitab Suci. Dalam berbagai mukjizat itu, kuasa Tuhan sangat nampak. Dalam setiap mukjizat terdapat kata-kata mutiara yang dapat membantu kita memaknai setiap mukjizat.        ","{'Kategori': 'Agama', 'Penyunting': 'Tim Penyunting', 'Ketebalan': '86 halaman', 'Dimensi': '15x23 cm', 'Bahasa': 'bahasa indonesia', 'Stock': 'Tersedia', 'Penerbit': 'Chivita Books', 'Penulis': 'Andreas Rudiyanto', 'Berat': '500 gram', 'Product Tags': ' \nagama\nandreas rudiyanto\nbuku agama\nchivita books\n\n'}",https://www.solusibuku.com/image/c/data/produk/2018/Slide036-cr-500x500.jpeg,https://www.solusibuku.com/agama/40-kisah-mukjizat-dalam-alkitab.html
20,La Tahzan For Hijabers,"Rp.35,600 ","
          Buku ini menyajikan kisah-kisah menyentuh hati dari perjalanan religiusitas dan spiritualitas para Muslimah dalam mengenakan hijab. Disajikan pula hikmah-hikmah yang diuraikan dari dua puluh sembilan kisah para hijabers. Selain itu, diuraikan pula dasar-dasar dan hukum syar’i dalam berhijab. Buku ini kita akan menguatkan siapa saja agar istiqomah dalam mengenakan hijab dan terutama menjalankan perintah agama. Kisah-kisah dalam buku ini disampaikan dengan bahasa yang lugas dan ringan agar mudah dipahami semua kalangan.        ","{'Kategori': 'Agama', 'Penyunting': 'Tim Penyunting', 'Ketebalan': '208 halaman', 'Dimensi': '20.5x14 cm', 'Bahasa': 'bahasa indonesia', 'Stock': 'Tersedia', 'Penerbit': 'Araska Publisher', 'Penulis': 'Humaira El Rahmi', 'Berat': '500 gram', 'Product Tags': ' \nagama\naraska publisher\nbuku agama\nhumaira el rahmi\n\n'}",https://www.solusibuku.com/image/c/data/produk/2018/Slide050-cr-500x500.jpeg,https://www.solusibuku.com/agama/la-tahzan-for-hijabers.html
21,Cukupkah Cinta Untuk Menikah,"Rp.54,000 ","
          Buku ini berisi ulasan tentang hal-hal yang perlu disiapkan untuk Anda yang sudah merencanakan untuk menikah. Penulis juga menunjukkan fakta bahwa ternyata cinta saja tidak cukup untuk membangun rumah tangga.        ","{'Kategori': 'Agama', 'Penyunting': 'Tim Penyunting', 'Ketebalan': '324 halaman', 'Dimensi': '20.5x14 cm', 'Bahasa': 'bahasa indonesia', 'Stock': 'Tersedia', 'Penerbit': 'Checklist', 'Penulis': 'Ernawati', 'Berat': '500 gram', 'Product Tags': ' \nagama\nbuku agama\nchecklist\nernawati\n\n'}",https://www.solusibuku.com/image/c/data/produk/2018/Slide073-cr-500x500.jpeg,https://www.solusibuku.com/agama/cukupkah-cinta-untuk-menikah.html
22,Panduan Praktis Perawatan Jenazah,"Rp.39,200 ","
          Buku ini memberikan pembelajaran bagaimana cara mengurus jenazah. Materi yang dipaparkan dalam buku ini adalah menunggui orang si ambang ajal, hal yang dilakukan ketika ajal sudah datang, yang semestinya dikerjakan keluarga orang yang sudah meninggal, cara memandikan jenazah, cara mengkafani jenazah, shalat jenazah, menguburkan jenazah, berbuat baik untuk orang meninggal dunia, dan ziarah kubur. Bonus surat Yasin dan doa Tahlil.        ","{'Kategori': 'Agama', 'Penyunting': 'Tim Penyunting', 'Ketebalan': '170 halaman', 'Dimensi': '20x14 cm', 'Bahasa': 'bahasa indonesia', 'Stock': 'Tersedia', 'Penerbit': 'C-Klik Media', 'Penulis': ""Muhammad Syafi'I Masykur"", 'Berat': '500 gram', 'Product Tags': ' \nagama\nbuku agama\nc-klik media\nmuhammad syafii masykur\n\n'}",https://www.solusibuku.com/image/c/data/produk/2018/Slide082-cr-500x500.jpeg,https://www.solusibuku.com/agama/panduan-praktis-perawatan-jenazah.html
23,Muhammad Saw Idolaku,"Rp.41,600 ","
          Buku ini mengisahkan tentang laku hidup dan sifat-sifat teladan Rasulullah Muhammad Saw. adalah salah satu cara terbaik untuk membentuk kepribadian putra dan putri kita menjadi individu-individu yang saleh dan salihah. Selain itu, buku ini juga mengulas tentang Sirah Nabawiyah, dalam buku ini juga diketengahkan berbagai kisah keteladanan dan sifat-sifat Rasulullah yang sudah seharusnya ditiru oleh kita semua selaku umatnya dengan harapan dapat memberi dampak positif dan sekaligus meningkatkan keimanan kita        ","{'Kategori': 'Agama', 'Penyunting': 'Tim Penyunting', 'Ketebalan': '268 halaman', 'Dimensi': '20x14 cm', 'Bahasa': 'bahasa indonesia', 'Stock': 'Tersedia', 'Penerbit': 'Brilliant Books', 'Penulis': 'Abu Umar Al-Ghifari', 'Berat': '500 gram', 'Product Tags': ' \nabu umar al ghifari\nagama\nbrilliant books\nbuku agama\n\n'}",https://www.solusibuku.com/image/c/data/produk/2018/Slide084-cr-500x500.jpeg,https://www.solusibuku.com/agama/muhammad-saw-idolaku.html
24,Risalah Puasa,"Rp.44,000 ","
          Risalah ini berisi tentang ajaran Islam yang menjadi salah satu rukun Islam, yakni puasa. Puasa merupakan ibadah sakral tetapi orang yang menunaikannya tidak tampak kesakralan dan kekhusyukannya. Oleh karena itu, puasa menjadi ibadah yang lain daripada yang lain. Meski demikian, ternyata masyarakat kita masih menyimpan berbagai pertanyaan tentang puasa. Materi dalam buku ini berupa fikih puasa, seputar puasa, qiyam Ramadhan, tadabur Ramadhan, hikmah & ibrah, puasa Arafah, Puasa Asyura, puasa Sya’ban, puasa Senin-Kamis, puasa Dawud, dan puasa pada Ayyam Al-Bidl.        ","{'Kategori': 'Agama', 'Penyunting': 'Tim Penyunting', 'Ketebalan': '188 halaman', 'Dimensi': '20x14 cm', 'Bahasa': 'bahasa indonesia', 'Stock': 'Tersedia', 'Penerbit': 'C-Klik Media', 'Penulis': 'Ali Abdullah', 'Berat': '500 gram', 'Product Tags': ' \nagama\nali abdullah\nbuku agama\nc-klik media\n\n'}",https://www.solusibuku.com/image/c/data/produk/2018/Slide085-cr-500x500.jpeg,https://www.solusibuku.com/agama/risalah-puasa.html
25,Jangan Ambil Suamiku,"Rp.43,600 ","
          Berisi kisah nyata para perempuan muslimah tangguh yang harus menghadapi kenyataan bahwa suami mereka tergoda perempuan lain. Ditulis berdasarkan kisah nyata sehingga bisa menjadi pelajaran bagi para pembacanya. Ceritanya menggunakan sudut pandang orang pertama sehingga para pembaca seperti merasakan langsung apa yang dialami oleh sang tokoh utama.        ","{'Kategori': 'Agama', 'Penyunting': 'Tim Penyunting', 'Ketebalan': '192 halaman', 'Dimensi': '20.5x14 cm', 'Bahasa': 'bahasa indonesia', 'Stock': 'Tersedia', 'Penerbit': 'Checklist', 'Penulis': 'Zhivana Astri, Dkk', 'Berat': '500 gram', 'Product Tags': ' \nagama\nbuku agama\nchecklist\nzhivana astri dkk\n\n'}",https://www.solusibuku.com/image/c/data/produk/2018/Slide089-cr-500x500.jpeg,https://www.solusibuku.com/agama/jangan-ambil-suamiku.html
26,Hal Hal Kecil Bermakna Besar,"Rp.44,400 ","
          Berisi pembahasan tentang hal-hal sederhana sehari-hari yang bisa memberikan pengaruh yang sangat besar terhadap kepribadian, keluarga, pekerjaan, pergaulan, persaudaraan, pendidikan, dan bisnis. Buku ini akan membuka pikiran kita bahwa sebaiknya kita jangan meremehkan hal-hal kecil, karena sering kali hal-hal yang kecil itu justru menjadi kunci untuk hidup sukses dan bahagia. Temanya sangat praktis, dibutuhkan dan disukai oleh para pembaca karena dapat membantu mengembangkan diri mereka.        ","{'Kategori': 'Agama', 'Penyunting': 'Tim Penyunting', 'Ketebalan': '260 halaman', 'Dimensi': '20.5x14 cm', 'Bahasa': 'bahasa indonesia', 'Stock': 'Tersedia', 'Penerbit': 'Checklist', 'Penulis': 'Mhd. Rois Almaududy', 'Berat': '500 gram', 'Product Tags': ' \nagama\nbuku agama\nchecklist\nmhd rois almaududy\n\n'}",https://www.solusibuku.com/image/c/data/produk/2018/Slide100-cr-500x500.jpeg,https://www.solusibuku.com/agama/hal-hal-kecil-bermakna-besar.html
27,20 Amalan Kecil Penghantar Ke Surga,"Rp.35,600 ","
          Buku ini memuat 20 amalan kecil yang seringkali diremehkan, dipandang sebelah mata, tetapi ternyata, bisa menjadikan Anda menggapai surga Allah Swt. Dilengkapi gagasan inti sehingga memudahkan pembaca dalam mempelajari dan memahami isi buku ini. Didukung dengan sumber-sumber yang sahih, baik dari Al-Qur’an, hadis, maupun pendapat para sahabat dan salafus salih.        ","{'Kategori': 'Agama', 'Penyunting': 'Tim Penyunting', 'Ketebalan': '192 halaman', 'Dimensi': '20.5x14 cm', 'Bahasa': 'bahasa indonesia', 'Stock': 'Tersedia', 'Penerbit': 'Semesta Hikmah Publishing', 'Penulis': 'Ust. Yusuf Awaludin', 'Berat': '500 gram', 'Product Tags': ' \nagama\nbuku agama\nsemesta hikmah publishing\nust yusuf awaludin\n\n'}",https://www.solusibuku.com/image/c/data/produk/2018/Slide125-cr-500x500.jpeg,https://www.solusibuku.com/agama/20-amalan-kecil-penghantar-ke-surga.html
28,Disayang Mertua  Dicintai Suami  Bahagia Dunia Akhirat,"Rp.35,600 ","
          Buku ini adalah sebuah refleksi dan kajian tentang hidup berumah tangga yang tentu saja sangat bermanfaat bagi para pembaca. Di dalam buku ini disajikan bagaimana dan seperti apa seharusnya seorang istri dalam bersikap ketika berhubungan dengan mertua, suami dan keluarga suami secara umum.        ","{'Kategori': 'Agama', 'Penyunting': 'Tim Penyunting', 'Ketebalan': '224 halaman', 'Dimensi': '20.5x14 cm', 'Bahasa': 'bahasa indonesia', 'Stock': 'Tersedia', 'Penerbit': 'Araska Publisher', 'Penulis': 'Ferry Taufiq El Jaquene', 'Berat': '500 gram', 'Product Tags': ' \nagama\naraska publisher\nbuku agama\nferry taufiq el jaquene\n\n'}",https://www.solusibuku.com/image/c/data/produk/2018/Slide142-cr-500x500.jpeg,https://www.solusibuku.com/agama/disayang-mertua-dicintai-suami-bahagia-dunia-akhirat.html
